[
  {
    "id": "imo-g3-fractions-0001",
    "exam": "imo",
    "grade": "3",
    "topic": "Fractions",
    "subtopic": "Fractions",
    "difficulty": "easy",
    "modes": ["practice", "mock"],
    "questionText": "What does 1/2 mean?",
    "image": "",
    "options": [
      "1 out of 2 equal parts",
      "2 out of 1 parts",
      "1 plus 2",
      "2 minus 1"
    ],
    "correctAnswer": 0,
    "explanation": "1/2 means one out of two equal parts, or half.",
    "tags": ["fractions", "imo", "grade3"],
    "sourceType": "generated"
  },
  {
    "id": "imo-g3-fractions-0002",
    "exam": "imo",
    "grade": "3",
    "topic": "Fractions",
    "subtopic": "Fractions",
    "difficulty": "easy",
    "modes": ["practice", "mock"],
    "questionText": "What does 1/4 mean?",
    "image": "",
    "options": [
      "1 out of 4 equal parts",
      "4 out of 1 parts",
      "One quarter",
      "Both A and C"
    ],
    "correctAnswer": 3,
    "explanation": "1/4 means one out of four equal parts, which is also called one quarter.",
    "tags": ["fractions", "imo", "grade3"],
    "sourceType": "generated"
  },
  {
    "id": "imo-g3-fractions-0003",
    "exam": "imo",
    "grade": "3",
    "topic": "Fractions",
    "subtopic": "Fractions",
    "difficulty": "easy",
    "modes": ["practice", "mock"],
    "questionText": "If a pizza is cut into 4 equal slices and you eat 1 slice, what fraction did you eat?",
    "image": "",
    "options": [
      "1/2",
      "1/3",
      "1/4",
      "1/5"
    ],
    "correctAnswer": 2,
    "explanation": "One slice out of 4 equal slices is 1/4.",
    "tags": ["fractions", "imo", "grade3"],
    "sourceType": "generated"
  },
  {
    "id": "imo-g3-fractions-0004",
    "exam": "imo",
    "grade": "3",
    "topic": "Fractions",
    "subtopic": "Fractions",
    "difficulty": "easy",
    "modes": ["practice", "mock"],
    "questionText": "Between 1/2 and 1/4, which fraction is larger?",
    "image": "",
    "options": [
      "1/2",
      "1/4",
      "Both equal",
      "Cannot tell"
    ],
    "correctAnswer": 0,
    "explanation": "1/2 (half) is greater than 1/4 (quarter) because half of something is more than a quarter.",
    "tags": ["fractions", "imo", "grade3"],
    "sourceType": "generated"
  },
  {
    "id": "imo-g3-fractions-0005",
    "exam": "imo",
    "grade": "3",
    "topic": "Fractions",
    "subtopic": "Fractions",
    "difficulty": "medium",
    "modes": ["practice", "mock"],
    "questionText": "If you shade 2 out of 4 equal parts of a shape, what fraction is shaded?",
    "image": "",
    "options": [
      "1/4",
      "2/4",
      "3/4",
      "4/4"
    ],
    "correctAnswer": 1,
    "explanation": "2 out of 4 equal parts is 2/4, which is the same as 1/2.",
    "tags": ["fractions", "imo", "grade3"],
    "sourceType": "generated"
  },
  {
    "id": "imo-g3-fractions-0006",
    "exam": "imo",
    "grade": "3",
    "topic": "Fractions",
    "subtopic": "Fractions",
    "difficulty": "easy",
    "modes": ["practice", "mock"],
    "questionText": "What is 1/2 of 10?",
    "image": "",
    "options": [
      "2",
      "5",
      "8",
      "20"
    ],
    "correctAnswer": 1,
    "explanation": "Half of 10 is 5.",
    "tags": ["fractions", "imo", "grade3"],
    "sourceType": "generated"
  },
  {
    "id": "imo-g3-fractions-0007",
    "exam": "imo",
    "grade": "3",
    "topic": "Fractions",
    "subtopic": "Fractions",
    "difficulty": "easy",
    "modes": ["practice", "mock"],
    "questionText": "What is 1/4 of 8?",
    "image": "",
    "options": [
      "1",
      "2",
      "4",
      "6"
    ],
    "correctAnswer": 1,
    "explanation": "One quarter of 8 is 2.",
    "tags": ["fractions", "imo", "grade3"],
    "sourceType": "generated"
  },
  {
    "id": "imo-g3-fractions-0008",
    "exam": "imo",
    "grade": "3",
    "topic": "Fractions",
    "subtopic": "Fractions",
    "difficulty": "medium",
    "modes": ["practice", "mock"],
    "questionText": "Which fraction represents three quarters?",
    "image": "",
    "options": [
      "1/3",
      "2/4",
      "3/4",
      "4/3"
    ],
    "correctAnswer": 2,
    "explanation": "3/4 means three out of four equal parts, or three quarters.",
    "tags": ["fractions", "imo", "grade3"],
    "sourceType": "generated"
  },
  {
    "id": "imo-g3-fractions-0009",
    "exam": "imo",
    "grade": "3",
    "topic": "Fractions",
    "subtopic": "Fractions",
    "difficulty": "medium",
    "modes": ["practice", "mock"],
    "questionText": "Riya ate 1/2 of a chocolate bar. Her brother ate 1/4. Who ate more?",
    "image": "",
    "options": [
      "Riya",
      "Brother",
      "Both ate equal",
      "Cannot tell"
    ],
    "correctAnswer": 0,
    "explanation": "1/2 is greater than 1/4, so Riya ate more.",
    "tags": ["fractions", "imo", "grade3"],
    "sourceType": "generated"
  },
  {
    "id": "imo-g3-fractions-0010",
    "exam": "imo",
    "grade": "3",
    "topic": "Fractions",
    "subtopic": "Fractions",
    "difficulty": "easy",
    "modes": ["practice", "mock"],
    "questionText": "In the fraction 3/4, what does the 4 represent?",
    "image": "",
    "options": [
      "Number of parts taken",
      "Total number of equal parts",
      "The whole number",
      "The numerator"
    ],
    "correctAnswer": 1,
    "explanation": "In a fraction, the bottom number (denominator) shows the total number of equal parts.",
    "tags": ["fractions", "imo", "grade3"],
    "sourceType": "generated"
  }
]
